"CategoryID","CategoryName","Description","Picture"
1,"Beverages","Soft drinks, coffees, teas, beers, and ales",(BINARY DATA)
2,"Condiments","Sweet and savory sauces, relishes, spreads, and seasonings",(BINARY DATA)
3,"Confections","Desserts, candies, and sweet breads",(BINARY DATA)
4,"Dairy Products","Cheeses",(BINARY DATA)
5,"Grains/Cereals","Breads, crackers, pasta, and cereal",(BINARY DATA)
6,"Meat/Poultry","Prepared meats",(BINARY DATA)
7,"Produce","Dried fruit and bean curd",(BINARY DATA)
8,"Seafood","Seaweed and fish",(BINARY DATA)
